{
  "schema_version": "1.0",
  "store_id": "audit-store:rio-claro-governance",
  "tenant_id": "tenant:demo-civic-lab",
  "campaign_id": "campaign:rio-claro-municipal-demo",
  "workspace_id": "workspace:rio-claro-2026-demo",
  "aggregate_version": 0,
  "last_event_hash": "GENESIS",
  "events": [],
  "idempotency_keys": [],
  "metadata": {
    "adapter": "IN_MEMORY_TEST_ONLY",
    "production_persistence": false
  }
}
